{
  "$schema": "../schemas/supplier_verification.schema.json",
  "version": "1.0.0",
  "verification_id": "ver-20260901-cj-cord-01",
  "candidate_id": "cand-cj-sku-magnetic-cord-6p",
  "supplier_id": "cj-us-warehouse-01",
  "sku": "CJ-SKU-MAGNETIC-CORD-6P",
  "verified_at": "2026-09-01T06:00:00Z",
  "verified_at_unix": 1788242400,
  "stock_level": 450,
  "warehouse_country": "US",
  "warehouse_type": "domestic",
  "warehouse_lat": 40.7128,
  "warehouse_lon": -74.0060,
  "shipping_method": "USPS",
  "quoted_product_cost": 3.80,
  "verified_product_cost": 3.85,
  "quoted_shipping_cost": 3.20,
  "verified_shipping_cost": 3.20,
  "price_drift_percent": 0.013,
  "duty_percent": 0.0,
  "lead_days_min": 3,
  "lead_days_max": 5,
  "defect_rate_percent": 0.8,
  "packaging_type": "custom_box",
  "verification_confidence": 0.95,
  "stability_score": 0.94,
  "status": "VERIFIED_PASS",
  "verification_notes": "Stock verified in US East hub; shipping verified USPS First Class; packaging confirmed custom retail box."
}
